{
  "operacion": "USUARIO_CREADO",
  "usuarioId": "uid-usuario-ficticio-etapa-25",
  "nombreVisible": "Usuario ficticio de prueba",
  "rol": "AUXILIAR",
  "activo": true,
  "version": 1,
  "puedeCambiarRol": true,
  "resumenTrabajoActivo": {
    "jornadasActivas": 0,
    "reservasActivas": 0,
    "correccionesPendientes": 0,
    "tieneTrabajoActivo": false,
    "bloqueosCambioRol": []
  },
  "creadoEn": "2026-07-18T15:00:00.000Z"
}
